commit	track	metric	status	description
20260611-full-eval	aemo	-5.394	keep	full evaluator: dispatch Torrens Island (SA1 only, 0 ep in NSW1 — station inactive)
20260611-full-eval	aemo	-7.117	discard	full evaluator: pretrain DT (original pilot) — worst performer, overly aggressive dispatch (326.5 MWh/ep)
20260611-expanded-eval	aemo	12.817	keep	expanded evaluator (5 regions, 6 periods, 288h ep, 5 ep/variant, 135 ep total): PPO RL mean_reward=+12.82 — dominates on FCAS ($10,628/ep)
20260611-expanded-eval	aemo	-3.105	keep	expanded evaluator: DT full-pretrained (8x512, ctx=180, trained on 24+16 ep) mean_reward=-3.11 — beats rule (-4.82), deg=2.5K/ep, but FCAS=$77/ep vs PPO's $10.6K
20260611-expanded-eval	aemo	-4.819	keep	expanded evaluator: rule heuristic mean_reward=-4.82 — high energy rev ($11.8K) but massive deg ($15.4K)
20260611-expanded-eval	aemo	-13.550	discard	expanded evaluator: pretrain DT (original 4x128 pilot) mean_reward=-13.55 — worst performer, overly aggressive (746 MWh/ep), deg=$13K/ep
20260702-lw-sweep	aemo	0.033682	keep	loss-weight grid sweep: aw=0.5 sw=0.0 — best proxy total loss, evaluator mean_reward=+0.200
20260702-lw-sweep	aemo	0.035861	keep	loss-weight grid sweep: aw=0.5 sw=0.005 — best balance (reward=+0.198, state_loss=0.95)
20260702-lw-sweep	aemo	0.036760	keep	loss-weight grid sweep: aw=0.5 sw=0.02 — best action loss, evaluator mean_reward=+0.192
20260702-lw-sweep	aemo	0.053356	keep	loss-weight grid sweep: baseline (aw=0.75 sw=0.01) — evaluator mean_reward=+0.194
20260702-molab	aemo	+1.522	keep	MoLab DT training: 8x384, ctx=180, aw=0.999 sw=0.002 rw=0.0001, batch=128, lr=3e-5, 2 epochs — trained on RTX 6000 Pro, uploaded to HF
a0399f6	aemo	GRPO-tuned DT vs dispatch_replay	keep	GRPO-tuned DT mean_reward=+1.32/step, profit=,973/ep, FCAS=,697/ep vs dispatch profit=63/ep, FCAS=10/ep (42x). DT mean_diff=+2.70/step vs dispatch (reference). SA1 4-season dispatch-matched eval.
f575c34	aemo	-1.54/step	keep	GRPO 30-iter DT on dispatch_matched SA1 2024: mean_reward=-1.54, profit=$1,268/ep vs dispatch $964/ep. FCAS=$4,747/ep. Overfit vs 5-iter model (+1.32). KL drift caused degradation cost to triple ($3,110 vs $965).
0c013ab	aemo	-0.32	keep	GRPO combined_best (15-iter, lr=5e-5, rtgc=2, 144h): dispatch_matched SA1 2024 reward=-0.32, profit=$2,398/ep, vs dispatch +1.06. Underperforms 5-iter default (lr=1e-5). 24h proxy sweep does not reliably predict 144h eval performance.
ee0844f	aemo	+1.60	keep	Multi-region GRPO DT (NSW1+SA1+QLD1 train): dispatch_matched eval across 6 scenarios (NSW1 Jan/Jul, SA1 Jan/Jul, QLD1 Jan, VIC1 Jan). Reward=+1.60, profit=$4,357/ep, FCAS=$5,171/ep, deg=$226/ep, Sharpe=13.90. Beats PPO (-1.53, $85/ep, $6,757 deg), dispatch (-1.88), fcas_rule (-64.72). DT mean_diff vs dispatch=+3.12.
b48f481	aemo	-12.39	keep	GRPO post-training 1C vs 3.75C on Q4 2024 multi-station eval (1C battery). 1C DT reward=-12.39 profit=$1,977 — beats original HF DT (-13.65/$874) and PPO (-15.50/$1,395). Far behind dispatch replays (Torrens +165/$169K, Hornsdale +62/$67K) but dispatch replays show unrealistic degradation ($20-23K/ep). 3.75C DT (-15.30) underperforms 1C DT on 1C battery. GRPO improves DT but gap to real dispatch remains large on small batteries.
cee733b	aemo	76938555	keep	New FCAS dataset with realistic batteries (v2): 2,401 episodes, 77M rows. Batteries: medium_1c (10MW/10MW=1C), large_07c (50MW/35MW=~0.7C), small_05c (2MW/1MW=0.5C), fast_375c (8MW/30MW=3.75C). 5 SB3 models retrained on all 4 batteries. Ready for MoLab DT pretraining.
exp0	modernv2_ppo_only_dt	2025 OOD: profit=$4,200/ep vs PPO $14,320 (PPO wins 3.4x); FCAS $1,854 vs $10,637; energy $4,468 vs $9,539. Energy edge from broad-2024 ($17,099) does not transfer to 2025.
exp0	legacy_ppo_only_dt	2025 OOD: profit=$4,327/ep vs PPO $14,320 (PPO wins 3.3x); FCAS $1,760 vs $10,637. Same regime-specific energy collapse as modern 8x768 — data not architecture.
exp0	modernv2_ppo_only_dt	dispatch-matched (full_fcas, rtg=0.5): profit=$7,590/ep vs PPO $7,757 (near-tie, 2% below); FCAS $5,884 vs $5,523. Much better than 2025 — competitive on the FCAS-heavy surface.
exp0	modernv2_ppo_only_dt	dispatch-matched rtg=0 (6-scenario SA1 Jul-Dec 2024, asset-sized): profit=$23,174/ep vs PPO $22,622 (DT wins 2.4%); FCAS $12,238 vs $12,244. DT edges PPO on the broad dispatch-matched surface.
exp0	modernv2_ppo_only_dt	standard Oct (full_fcas, 5 regions, rtg=0.5): profit=$2,668/ep vs PPO $2,353 (DT wins 13%); FCAS $2,435 vs $2,192. Below mixed modern v2 ($4,630) but beats PPO.
exp0	legacy_ppo_only_dt	standard Oct (full_fcas, 5 regions, rtg=0.5): profit=$2,426/ep vs PPO $2,353 (DT wins 3%); FCAS $2,268 vs $2,192. Consistent with modern 8x768.
exp0	legacy_ppo_only_dt	dispatch-matched rtg=0 (SA1 Jul-Dec 2024, 6 scen): profit=$23,802/ep vs PPO $22,622 (DT wins 5%); FCAS $11,933 vs $12,244. Consistent with modern 8x768.
exp2	mixed_head_fcasheavy	expanded broad-2024 (multi_market, rtg=10): profit=$10,779/ep vs tanh control $13,387 (worse); FCAS $5,198 vs $5,860; energy $10,497 vs $12,578. BUT multi_market drops 6/8 FCAS dims - neutralizes mixed head. Proper test = full_fcas surfaces.
exp2	mixed_head_fcasheavy	dispatch-matched rtg=0 (full_fcas 9-dim): profit=$15,160 vs PPO $22,622; FCAS $18,320 vs PPO $12,244 (DT captures +50% MORE FCAS than PPO - strongest of any DT variant). Energy $15,896. Need tanh control on same surface to isolate head effect.
exp2	tanh_control_fcasheavy	dispatch-matched rtg=0 (full_fcas): profit=$19,083 vs mixed-head $15,160 (control BETTER); FCAS $20,013 vs $18,320; energy $14,290 vs $15,896. Mixed head does NOT help - data ceiling confirmed. Both FCAS-heavy models beat PPO on FCAS (+50-63%) but not profit.
exp2	tanh_control_fcasheavy	standard Oct (full_fcas, 5 regions): profit=$6,100 vs PPO $2,353 (2.6x) and dispatch $4,660 (31%); FCAS $5,943 vs PPO $2,192. Strong narrow-surface win.
exp2	mixed_head_fcasheavy	standard Oct (full_fcas): profit=$6,111 vs tanh $6,100 (tie); FCAS $5,953 vs $5,943. Head comparison: standard tie, dispatch-matched mixed worse (-19%), expanded worse (-20%). Mixed head does NOT help - output geometry not the binding constraint.
exp2	tanh_control_fcasheavy	2025 OOD (multi_market): profit=$10,256 vs PPO $14,320 (PPO wins 1.4x but best DT OOD yet - prior PPO-only $4.2k, full-PPO fine-tune -$694); FCAS $5,654 vs $10,637. FCAS-heavy composition is the best OOD DT so far.
exp2	mixed_head_fcasheavy	2025 OOD (multi_market): profit=$12,488 vs tanh $10,256 (+22%) vs PPO $14,320 (15% gap - BEST DT OOD ever). Mixed head helps OOD substantially but hurts ID full_fcas surfaces. Net: mixed head is a wash-to-negative for deployment; tanh+FCAS-heavy is the safer narrow winner.
exp3	dt_soc_oracle	smoke mini (full_fcas): profit=$2,728 vs PPO $1,235 (2.2x). LP is degradation-blind (raw LP revenue $13k/$75k collapsed to $2.7k by degradation in env replay). Waypoint path + LP executor works end-to-end.
exp3	dt_soc_oracle	standard Oct (full_fcas): profit=$9,200 (3.9x PPO $2,353; 1.5x best prior DT tanh-fcasheavy $6,100); FCAS $11,889 (5.4x PPO); energy $19,194. Hierarchical DT+LP wins BOTH surfaces - design goal achieved.
exp3	dt_soc_oracle	2025 OOD (full_fcas): profit=-$22,087 vs PPO $6,498 (COLLAPSE). Root cause: LP executor is degradation-blind (deg $2,859/MWh vs PPO $211/MWh, 13.5x); Oracle-style aggressive cycling destroys battery OOD. Hierarchical needs degradation-aware executor.
exp3	dt_soc_oracle_deg_aware	2025 OOD (full_fcas, deg_cost=$50/MWh): profit=$6,809 vs PPO $6,498 (DT WINS); FCAS $12,061 (6.6x PPO); deg $420/MWh (from $2,859 blind). Energy -$1,056 (penalty killed arbitrage). Fix confirmed: -2k -> +$6.8k. Strongest DT OOD result.
exp3	dt_soc_oracle_deg_aware	standard Oct (full_fcas, deg=$50/MWh): profit=$23,372 (10x PPO $2,353); FCAS $14,387 (6.6x PPO); energy $10,749; deg $176/MWh (down from $2,859 deg-blind). Degradation-aware LP improves BOTH profit and degradation - definitive hierarchical win.
exp3	dt_soc_oracle_deg_aware	expanded broad-2024 (full_fcas, deg=$50/MWh): profit=$23,772 vs PPO $19,504 (DT +22% - first to beat PPO on broad surface); FCAS $24,880 (6.3x PPO); energy $3,389. Hierarchical achieves broad-surface win.
exp3	dt_soc_oracle_deg_aware	dispatch-matched rtg=0 (full_fcas): profit=$291,841 (13x PPO $22,530; 7.8x dispatch $37,371); FCAS $148,935 (12x PPO); energy $150,400. Strongest dispatch-matched result ever.
exp3a	dt_soc_sdp	honset (no foresight)	2025 OOD (full_fcas): profit=$13,046 vs PPO $6,498 (2x) AND beats perfect-foresight LP $6,809. FCAS $11,183 (6.2x PPO), energy $3,488, deg $163/MWh (below PPO $211). The foresight caveat is LIFTED and foresight actually hurt OOD (LP over-cycled).
exp3a	dt_soc_sdp	honest (no foresight)	standard Oct (full_fcas): profit=$15,606 (6.6x PPO $2,353); FCAS $11,371 (5.2x PPO); energy $5,217; deg $98/MWh. Below LP $23,372 (foresight) as expected, but genuinely non-clairvoyant.
exp3a	dt_soc_sdp	honest (no foresight)	expanded broad-2024 (full_fcas): profit=$25,183 vs PPO $19,504 (+29%) AND beats perfect-foresight LP $23,772. FCAS $24,177 (6.1x PPO), energy $3,839.
exp3a	dt_soc_sdp	honest (no foresight)	dispatch-matched rtg=0 (full_fcas): profit=$59,091 (2.6x PPO $22,530; 1.6x dispatch $37,371); FCAS $48,188; energy $14,661. Below LP $291,841 (foresight captures SA1 Q4 spikes perfectly) but honest.
impact_gate	dt_soc_sdp	honest (no foresight)	IMPACT PASS: piecewise_merit_order profit vs PPO — small $40,912 vs $11,031 (3.7x), hornsdale $486,585 vs $56,540 (8.6x), torrens $491,991 vs $69,507 (7.1x). No regression under impact. (LP executor collapses at torrens 250MW: -$632k, known Oracle_MI grid-scale limitation.)
stage_b	standalone_dt (mixed, sdp-teacher)	2025 OOD: profit=$11,925 vs PPO $6,498 (1.83x); FCAS $10,482 (5.8x PPO); energy $2,897; deg $145/MWh. Retains 91% of Stage A's $13,046 WITHOUT solver at inference - FCAS-cloning ceiling broken.
stage_b	standalone_dt (mixed, sdp-teacher)	standard Oct: profit=$7,914 vs PPO $2,353 (3.4x); FCAS $8,275 (3.8x PPO); deg $88/MWh. Retains 51% of Stage A's $15,606 with no solver (pilot, 160 eps).
stage_b	standalone_dt (mixed, sdp-teacher)	expanded broad-2024: profit=$11,943 vs PPO $19,504 (PPO wins - energy $3,237 vs PPO $17,381); FCAS $10,143 (2.6x PPO). Pilot (160 eps, short+medium) under-learns energy arbitrage; full-corpus retrain expected to fix.
stage_b	standalone_dt (mixed, sdp-teacher)	dispatch-matched rtg=0: profit=$47,942 (2.1x PPO $22,530; 1.28x dispatch $37,371); FCAS $34,554 (2.8x PPO). Retains 81% of Stage A's $59,091.
stage_b	standalone_dt (mixed, sdp-teacher)	IMPACT PASS: piecewise_merit_order mean profit vs PPO — small $33,141 vs $11,031 (3.0x), hornsdale $105,491 vs $56,540 (1.9x), torrens $148,802 vs $69,507 (2.1x). No torrens collapse (unlike LP executor's -$632k). Standalone DT impact-robust.
stage_b	full-corpus generation	SDP-teacher trajectories full: 320 eps, 3.13M rows, all 4 batteries (medium_1c/fast_375c/large_07c/small_05c) x short+medium x 5 regions, balanced. data/aemo_dt_sdp/dt_trajectories_full.parquet
stage_b	aggressive-teacher corpus	deg_cost_per_mwh=20: 320 eps, 3.13M rows, |energy|+57% (0.072->0.112) vs conservative, FCAS bids -6%. Complementary energy-heavy teacher for RTG interpolation. data/aemo_dt_sdp/dt_trajectories_aggressive.parquet
stage_b	standalone_dt full-corpus (mixed, 320eps)	2025 OOD: profit=$12,881/ep vs PPO $6,498 (1.98x); FCAS $12,334 (6.8x PPO $1,815); energy $2,069. Improves on pilot 160-ep ($11,925/1.83x). eval_output/stageb_fullcorpus_mixed_2025
stage_b	standalone_dt full-corpus (mixed, 320eps)	standard Oct: profit=$9,071 vs PPO $2,353 (3.85x); FCAS $9,352 (4.3x PPO). Improves on pilot ($7,914/3.4x). eval_output/stageb_fullcorpus_mixed_standard
stage_b	standalone_dt full-corpus (mixed, 320eps)	dispatch-matched rtg0: profit=$50,671 vs PPO $22,530 (2.25x) vs dispatch $37,371 (1.36x); FCAS $39,419 (3.2x PPO). Improves on pilot ($47,942/2.1x). eval_output/stageb_fullcorpus_mixed_dispatch
stage_b	standalone_dt full-corpus (mixed, 320eps)	expanded broad-2024: profit=$11,987 vs PPO $19,504 (PPO wins 1.6x); FCAS $11,766 (3x PPO $3,941); energy $1,778 vs PPO $17,381. Energy-arbitrage gap PERSISTS despite full corpus - the binding constraint (not data size). eval_output/stageb_fullcorpus_mixed_expanded
stage_b	standalone_dt full-corpus (mixed, 320eps)	IMPACT PASS: piecewise_merit_order vs PPO — small $31,924 vs $11,031 (2.9x), hornsdale $146,588 vs $56,540 (2.6x), torrens $207,672 vs $69,507 (3.0x). Improved over pilot (hornsdale +39%, torrens +40%). Best-rtg=5. No torrens collapse.
stage_b	standalone_dt full-corpus (mixed, 320eps)	VERDICT: beats PPO on 3/4 identity surfaces (standard 3.85x, dispatch 2.25x, 2025 1.98x) + impact gate (2.6-3.0x). ONE MISS remains: expanded broad-2024 energy arbitrage ($1.8k vs PPO $17.4k) - FCAS-cloning solved by full corpus but energy trading under-learned from conservative SDP teacher. Not yet the full broad-surface preferred policy.
stage_c	standalone_dt_jtsoc_fullcorpus	1.98	keep	2025 OOD: profit=$12,881/ep vs PPO $6,498 (1.98x), FCAS $12,334 (6.8x PPO)
stage_c	standalone_dt_jtsoc_fullcorpus	3.85	keep	Standard Oct: profit=$9,071/ep vs PPO $2,353 (3.85x); FCAS $9,352 (4.3x PPO)
stage_c	standalone_dt_jtsoc_fullcorpus	2.25	keep	Dispatch-matched: profit=$50,671 vs PPO $22,530 (2.25x) vs dispatch $37,371 (1.36x)
stage_c	standalone_dt_jtsoc_fullcorpus	1.39	keep	Expanded broad-2024: profit=$27,068 vs PPO $19,504 (1.39x); FCAS $11,766 (3x PPO); energy $14,799
stage_c	standalone_dt_jtsoc_fullcorpus	IMPACT_PASS	keep	Impact gate PASS: piecewise_merit_order vs PPO — small 2.9x, hornsdale 2.54x, torrens 1.65x (no torrens collapse)
h4_2_no_forecast	household_dt_8x512_jtsoc	232.32	keep	Retrained no-forecast control on 10 fixed 7-day real-OOD windows: +$232.32/yr savings vs no battery (95% CI annualized bill $597–$1,172; zero FutureSolar/FutureLoad in training and evaluation). eval_output/household/h4_2_no_forecast
h4_2_ttm	household_dt_8x512_jtsoc	381.76	keep	Offline causal TTM-R3 forecast DT vs exactly matched no-forecast DT +$264.40/yr on 10 fixed 7-day real-OOD windows; paired advantage +$117.36/yr (95% CI +$64.55–$163.82, 9/10 wins, one-sided Wilcoxon p=0.0029). TTM real solar/load MAE improved 39.2%/17.5%. eval_output/household/h4_2_ttm_forecast
h4_2_ttm	household_dt_8x512_standard_rtg	258.50	keep	Matched causal standard-RTG (prompt -2 from training median) on 10 fixed 7-day real-OOD windows: TTM +$258.50/yr, 24h persistence +$216.74/yr, no forecast +$155.12/yr. TTM vs persistence +$41.75/yr (95% CI +$16.56-$69.43, 9/10, p=0.0068); TTM vs no forecast +$103.37/yr (95% CI +$78.23-$127.67, 10/10, p=0.0010). eval_output/household/h4_2_ttm_standard_rtg_neg2
h4_4_full	household_synthetic_corpus	240	keep	H4.1 full corpus built at data/household/synth_h4_1: 240 episodes (5 archetypes x 4 seasons x 3 capacities x horizons 1w/2w/6m/2y), 55,860 episode-days, schema-v2 manifest, 165/35/40 split, 158 real OOD dates held out. 23/40 train 2y episodes terminate early on degradation exhaustion (identical across forecast variants).
h4_4_ttm	household_dt_8x512_standard_rtg_fullcorpus	357.29	keep	Full-corpus matched standard-RTG (prompt -2 from training median -1.78) on 10 fixed 7-day real-OOD windows: TTM +$357.29/yr, 24h persistence +$309.35/yr, no forecast +$310.90/yr, fresh full-corpus PPO +$23.66/yr, rule +$58.03/yr, oracle +$738.96/yr. TTM vs persistence +$47.94/yr (95% CI +$27.99-$67.59, 9/10, p=0.0020); TTM vs no-forecast +$46.39/yr (95% CI +$23.78-$68.91, 9/10, p=0.0020); persistence vs no-forecast -$1.55/yr (p=0.46). eval_output/household/h4_4_{ttm,persistence,no_forecast}_real_ood, h4_4_real_ood_stats.json
h4_4_ttm	household_dt_synth_test_fullcorpus	-15.49	discard	On the 20-window synthetic test surface (mixed 5/10/20 kWh per-episode batteries) the three matched full-corpus DTs are statistically indistinguishable (TTM $1,049.62 vs no-forecast $1,065.11; TTM-no_forecast -$15.49/yr, 95% CI -$133.5-$127.6, p=0.86, per-horizon mixed). Forecast benefit proven on the held-out real household, not yet on the broad synthetic multi-battery surface. eval_output/household/h4_4_*_synth_test, h4_4_synth_test_stats.json
h4_4_fix	household_forecast_sidecar	column_order	keep	Fixed apply_forecast_sidecar to preserve env column order (previously moved FutureSolar/FutureLoad to the end, giving the TTM arm a different obs layout). Repaired mirror corpus and regenerated h4_4_ttm_sdp trajectories; verified identical action/reward/RTG labels across all three variants, differing only in forecast dims 6-7. tests/test_household_forecast.py::test_apply_sidecar_preserves_column_order
